是的，但是有时候我不能看体育直播，也许这是一个地区性的问题，我希望以后能看到。但我看到它是精心制作的，所以我给了它四颗星。	ADV
我刚刚学会使用它。我觉得很好	GF
是的，但有时我不能看体育直播。也许这是一个地区问题。我希望将来能看到它。但我仍然看到它做得很好，所以我给它四颗星	ADV
网易云音乐很温暖，音乐力量巨大	GF
我觉得可以学习使用	GF
网易云音乐非常火爆，音乐威力巨大	GF
不错，但有时候体育不能直播，可能是地区问题，希望以后再说。但我仍然看到一切都是正确的，所以给我四颗星。	ADV
好吧，但有时候我不能看体育直播。可能是地区问题，希望你以后能看到。但是我看到你对我很亲切，我就把它送给了四星。	ADV
音乐是温暖的，音乐的力量是巨大的。	GF
音乐非常热烈，音乐的力量是巨大的	GF
是的，但是有时候看体育直播看不到，也许是区域性的问题，希望以后能看。但我还是觉得我做得很好，所以给他四颗星。	ADV
只是学习，我感觉很好。	GF
网易云音乐非常温暖，音乐的力量是巨大的	GF
网易云音乐非常温暖，音乐的力量巨大	GF
我刚刚学会了如何使用它。	GF
是的，但有时我不能看体育直播。也许这是一个地区问题。我希望以后能看。但我仍然看到它做得很好，所以我把它给了四星	ADV
